{
  "request_id": "req_20260227_vector_projection",
  "topic": "向量投影",
  "learner_profile": {
    "level": "beginner",
    "age_group": "high_school",
    "prior_knowledge": [
      "向量加减",
      "点积基础"
    ]
  },
  "goal": "理解投影长度、符号意义，并能在几何图中解释结果",
  "duration_min": 25,
  "style": "直观+步骤化",
  "language": "zh-CN",
  "must_include": [
    "生活案例",
    "可操作练习"
  ],
  "must_avoid": [
    "超纲证明"
  ],
  "output_format": [
    "json",
    "markdown",
    "dsl_patch"
  ]
}
